cluster,size,total_occurrences,top_terms,example_questions
5,289,658,"wert, haus, eines, wer","Ist es sinnvoll, ein Wertgutachten zu machen? | Wie kann ich den Wert meines Hauses selbst ermitteln? | Wie bekomme ich heraus, wie viel mein Haus Wert ist?"
6,73,242,"verkehrswert, verkehrswert einer, einer, verkehrswert eines",Ist der Verkehrswert gleich Kaufpreis? | Wie kann ich den Verkehrswert meiner Immobilie ermitteln? | Wie bekomme ich den Verkehrswert einer Immobilie heraus?
4,56,213,"immobilienbewertung, kostet, kostet immobilienbewertung, beste",Welche Immobilienbewertung akzeptiert das Finanzamt? | Was kostet eine seriöse Immobilienbewertung? | Was kostet ein Gutachten für eine Immobilienbewertung?
2,53,210,"gutachter, immobiliengutachten, kostet, gutachter haus","Was ist besser, Makler oder Gutachter? | Welche Immobiliengutachten akzeptiert das Finanzamt? | Was kostet ein unabhängiger Gutachter für Immobilien?"
0,61,197,"einer, einer immobilie, immobilie, wert einer",Wie kann ich den Wert meiner Immobilie ermitteln? | Wie kann ich selbst den Wert einer Immobilie ermitteln? | Wie kann ich den Wert einer Immobilie selbst ermitteln?
7,45,195,"lassen, bewerten, schätzen lassen, schätzen",Wo kann ich den Wert meines Hauses kostenlos schätzen lassen? | Wo kann ich meine Immobilie kostenlos bewerten lassen? | Wo kann ich kostenlos den Wert meiner Immobilie schätzen lassen?
3,50,86,"kostet, wertgutachten, kostet wertgutachten, haus",Wie viel kostet ein Verkehrswertgutachten? | Was kostet die Erstellung eines Gutachtens? | Was kostet eine Immobilienschätzung vom Ortsgericht?
8,41,67,"immobilien, bewertet, bedeutet, gutachten immobilien",Wer darf Gutachten für Immobilien erstellen? | Wie wird man vereidigter Sachverständiger Immobilien? | Wie hoch ist der Kaufpreisfaktor für Immobilien in München?
1,28,53,"immobilienwert, ermittelt, immobilienwert schenkung, finanzamt immobilienwert",Was kostet ein Kurzgutachten für den Immobilienwert? | Wie wird der Vergleichswert ermittelt? | Wie wird der Immobilienwert bei Erbe ermittelt?
9,18,49,"immobiliengutachter, kostet immobiliengutachter, zertifizierter, zertifizierter immobiliengutachter",Wer zahlt Immobiliengutachter? | Was kostet ein unabhängiger Immobiliengutachter? | Wie wird man zertifizierter Immobiliengutachter?
